{
    "schema_version": 1,
    "optimization_id": "freqai-baseline-signal-thresholds-v1",
    "stage": "signal_thresholds",
    "experiment_manifest": "ai_platform/experiments/baseline-v1.json",
    "validation_plan": "ai_platform/validation/baseline-validation-v1.json",
    "training": {
        "name": "train-context-2025-12-2026-02",
        "timerange": "20251201-20260228"
    },
    "tuning": {
        "name": "tune-2026-03-04",
        "timerange": "20260301-20260430"
    },
    "final_holdout": {
        "name": "holdout-2026-05-06",
        "timerange": "20260501-20260630"
    },
    "hyperopt": {
        "spaces": ["buy"],
        "epochs": 100,
        "random_state": 42,
        "min_trades": 20,
        "loss": "MultiMetricHyperOptLoss",
        "job_workers": -2
    },
    "parameter_stability": {
        "parameter": "entry_prediction_threshold",
        "step": 0.001,
        "minimum": 0.001,
        "maximum": 0.02,
        "maximum_profit_drop": 0.05,
        "maximum_drawdown_increase": 0.1,
        "minimum_trade_count_ratio": 0.5
    },
    "output_root": "ai_platform/artifacts/optimization"
}
